field_name, field_type, label, categorical, business_key, format_code
id, STRING, id, false, true
business_line, STRING, business_line, false, true
product_line, STRING, product_line, false, true
region, STRING, region, false, true
subregion, STRING, subregion, false, true
mortgage_type, STRING, mortgage_type, false, true
commissions_fees, FLOAT, commissions_fees, false, false
early_termination_early_payments, FLOAT, early_termination_early_payments, false, false
deliquency_fees, FLOAT, deliquency_fees, false, false